{
  "schemaVersion": 1,
  "documentId": "darovan_d10_culture_society",
  "version": "0.1",
  "preparedAt": "2026-10-23",
  "phase": "D10",
  "status": "planning_reference_not_runtime",
  "canonStatus": "author_approved_17_conceptual_choices",
  "authorityChain": [
    "nimroel_core",
    "norgard_defaults",
    "casa_darovan",
    "locality",
    "world_state"
  ],
  "sourceRefs": {
    "approvalD10": "Worldbuilding/Reinos/Reinos de los Hombres/Norgard/Territorios/Casa Darovan/Auditorias/D10_AUDITORIA_CANON_Y_DECISIONES_2026-10-23.md",
    "matrixD10": "Worldbuilding/Reinos/Reinos de los Hombres/Norgard/Territorios/Casa Darovan/Cultura_y_sociedad/D10_MATRIZ_CANON_FUENTES_DECISIONES_v0.1.md",
    "identityD10": "Worldbuilding/Reinos/Reinos de los Hombres/Norgard/Territorios/Casa Darovan/Cultura_y_sociedad/D10_IDENTIDAD_SOCIAL_v0.1.md",
    "localD10": "Worldbuilding/Reinos/Reinos de los Hombres/Norgard/Territorios/Casa Darovan/Cultura_y_sociedad/D10_PERFILES_LOCALES_v0.1.md",
    "everydayD10": "Worldbuilding/Reinos/Reinos de los Hombres/Norgard/Territorios/Casa Darovan/Cultura_y_sociedad/D10_VIDA_COTIDIANA_v0.1.md",
    "relationsD10": "Worldbuilding/Reinos/Reinos de los Hombres/Norgard/Territorios/Casa Darovan/Cultura_y_sociedad/D10_RELACIONES_Y_NPC_v0.1.md",
    "treihord": "Worldbuilding/Reinos/Reinos de los Hombres/Norgard/Ciudades/Casa Darovan/Treihord.md",
    "greatHouses": "Worldbuilding/Reinos/Reinos de los Hombres/Norgard/Grandes Casas/grandes_casas.md",
    "norgardVisual": "Worldbuilding/Direccion artistica/Biblia visual/Culturas/Norgard/NORGARD_VISUAL_PROFILE_v0.1.md",
    "d02": "Worldbuilding/Reinos/Reinos de los Hombres/Norgard/Territorios/Casa Darovan/Datos operativos/darovan_d02_hydro_network_v0.1.json",
    "d04": "Worldbuilding/Reinos/Reinos de los Hombres/Norgard/Territorios/Casa Darovan/Datos operativos/darovan_d04_resources_production_v0.1.json",
    "d05": "Worldbuilding/Reinos/Reinos de los Hombres/Norgard/Territorios/Casa Darovan/Datos operativos/darovan_d05_mobility_communications_v0.1.json",
    "d06": "Worldbuilding/Reinos/Reinos de los Hombres/Norgard/Territorios/Casa Darovan/Datos operativos/darovan_d06_settlement_rules_v0.1.json",
    "d07": "Worldbuilding/Reinos/Reinos de los Hombres/Norgard/Territorios/Casa Darovan/Datos operativos/darovan_d07_canonical_cities_v0.1.json",
    "d08": "Worldbuilding/Reinos/Reinos de los Hombres/Norgard/Territorios/Casa Darovan/Datos operativos/darovan_d08_population_services_v0.1.json",
    "d09": "Worldbuilding/Reinos/Reinos de los Hombres/Norgard/Territorios/Casa Darovan/Datos operativos/darovan_d09_governance_security_v0.1.json",
    "norgardFuneral": "Worldbuilding/Sistemas/Norgard Defaults/01_Sociedad/funeral_cremacion_retorno_luto_v0.1.md",
    "norgardToponyms": "Worldbuilding/Sistemas/Norgard Defaults/03_Toponimia/convencion_toponimica_default_v0.1.md",
    "norgardFamily": "Worldbuilding/Sistemas/Norgard Defaults/09_Familia_y_derecho_civil/familia_matrimonio_tutela_adopcion_v0.1.md",
    "norgardLabor": "Worldbuilding/Sistemas/Norgard Defaults/10_Trabajo_y_capacidad/mayoria_edad_capacidad_trabajo_aprendizaje_v0.1.md",
    "norgardProperty": "Worldbuilding/Sistemas/Norgard Defaults/11_Propiedad_herencia_alquiler/propiedad_herencia_alquiler_v0.1.md",
    "norgardCuisine": "Worldbuilding/Sistemas/Norgard Defaults/13_Gastronomia/gastronomia_alimentacion_norgard_v0.1.md",
    "norgardNames": "Worldbuilding/Sistemas/Norgard Defaults/14_Nombres_apellidos/nombres_apellidos_norgard_v0.1.md",
    "norgardCalendar": "Worldbuilding/Sistemas/Norgard Defaults/15_Calendario/calendario_civil_norgard_v0.1.md",
    "norgardMaterial": "Worldbuilding/Sistemas/Norgard Defaults/16_Cultura_material/cultura_material_comun_norgard_v0.1.md",
    "norgardPersonality": "Worldbuilding/Sistemas/Norgard Defaults/Personalidad_NPC/personalidad_persistente_npc_humanos_norgard_v0.1.md",
    "coreKin": "Worldbuilding/Sistemas/Nimroel Core/Datos operativos/nimroel_kinship_family_network_contract_v0.1.json",
    "coreFriend": "Worldbuilding/Sistemas/Nimroel Core/Datos operativos/nimroel_friendship_social_circles_contract_v0.1.json",
    "coreFavor": "Worldbuilding/Sistemas/Nimroel Core/Datos operativos/nimroel_favors_reciprocity_informal_debt_contract_v0.1.json",
    "coreGift": "Worldbuilding/Sistemas/Nimroel Core/Datos operativos/nimroel_gifts_social_meaning_contract_v0.1.json",
    "corePers": "Worldbuilding/Sistemas/Nimroel Core/Datos operativos/nimroel_persistent_personality_profile_contract_v0.1.json",
    "coreName": "Worldbuilding/Sistemas/Nimroel Core/Datos operativos/nimroel_personal_name_identity_contract_v0.1.json",
    "coreFood": "Worldbuilding/Sistemas/Nimroel Core/Datos operativos/nimroel_food_cooking_preservation_contract_v0.1.json",
    "coreDialog": "Worldbuilding/Sistemas/Nimroel Core/Datos operativos/nimroel_dialogue_dynamics_contract_v0.1.json"
  },
  "authorDecisions": [
    {
      "id": "DAR-D10-01",
      "option": "B",
      "scope": "regional_diverse_identity",
      "provenance": "AUTHORED_CONCEPT",
      "approval": "AUTHOR_BATCH_2026-10-23",
      "createsInstitutions": false,
      "createsPersons": false,
      "createsEvents": false,
      "createsLocalLaw": false
    },
    {
      "id": "DAR-D10-02",
      "option": "B",
      "scope": "socioeconomic_difference_mobility",
      "provenance": "AUTHORED_CONCEPT",
      "approval": "AUTHOR_BATCH_2026-10-23",
      "createsInstitutions": false,
      "createsPersons": false,
      "createsEvents": false,
      "createsLocalLaw": false
    },
    {
      "id": "DAR-D10-03",
      "option": "B",
      "scope": "professional_experience_not_personality",
      "provenance": "AUTHORED_CONCEPT",
      "approval": "AUTHOR_BATCH_2026-10-23",
      "createsInstitutions": false,
      "createsPersons": false,
      "createsEvents": false,
      "createsLocalLaw": false
    },
    {
      "id": "DAR-D10-04",
      "option": "B",
      "scope": "galdren_economic_rivalry_contextual",
      "provenance": "AUTHORED_CONCEPT",
      "approval": "AUTHOR_BATCH_2026-10-23",
      "createsInstitutions": false,
      "createsPersons": false,
      "createsEvents": false,
      "createsLocalLaw": false
    },
    {
      "id": "DAR-D10-05",
      "option": "B",
      "scope": "treihord_canonical_social_areas",
      "provenance": "AUTHORED_CONCEPT",
      "approval": "AUTHOR_BATCH_2026-10-23",
      "createsInstitutions": false,
      "createsPersons": false,
      "createsEvents": false,
      "createsLocalLaw": false
    },
    {
      "id": "DAR-D10-06",
      "option": "B",
      "scope": "veldora_trade_contacts_nonmandatory",
      "provenance": "AUTHORED_CONCEPT",
      "approval": "AUTHOR_BATCH_2026-10-23",
      "createsInstitutions": false,
      "createsPersons": false,
      "createsEvents": false,
      "createsLocalLaw": false
    },
    {
      "id": "DAR-D10-07",
      "option": "B",
      "scope": "taramin_fishing_with_diversity",
      "provenance": "AUTHORED_CONCEPT",
      "approval": "AUTHOR_BATCH_2026-10-23",
      "createsInstitutions": false,
      "createsPersons": false,
      "createsEvents": false,
      "createsLocalLaw": false
    },
    {
      "id": "DAR-D10-08",
      "option": "B",
      "scope": "syvaris_insular_without_isolation",
      "provenance": "AUTHORED_CONCEPT",
      "approval": "AUTHOR_BATCH_2026-10-23",
      "createsInstitutions": false,
      "createsPersons": false,
      "createsEvents": false,
      "createsLocalLaw": false
    },
    {
      "id": "DAR-D10-09",
      "option": "C",
      "scope": "arven_identity_unknown",
      "provenance": "AUTHORED_CONCEPT",
      "approval": "AUTHOR_BATCH_2026-10-23",
      "createsInstitutions": false,
      "createsPersons": false,
      "createsEvents": false,
      "createsLocalLaw": false
    },
    {
      "id": "DAR-D10-10",
      "option": "B",
      "scope": "rural_profiles_conditioned_on_evidence",
      "provenance": "AUTHORED_CONCEPT",
      "approval": "AUTHOR_BATCH_2026-10-23",
      "createsInstitutions": false,
      "createsPersons": false,
      "createsEvents": false,
      "createsLocalLaw": false
    },
    {
      "id": "DAR-D10-11",
      "option": "B",
      "scope": "food_from_existing_norgard_canon",
      "provenance": "AUTHORED_CONCEPT",
      "approval": "AUTHOR_BATCH_2026-10-23",
      "createsInstitutions": false,
      "createsPersons": false,
      "createsEvents": false,
      "createsLocalLaw": false
    },
    {
      "id": "DAR-D10-12",
      "option": "B",
      "scope": "material_by_climate_resources_individual",
      "provenance": "AUTHORED_CONCEPT",
      "approval": "AUTHOR_BATCH_2026-10-23",
      "createsInstitutions": false,
      "createsPersons": false,
      "createsEvents": false,
      "createsLocalLaw": false
    },
    {
      "id": "DAR-D10-13",
      "option": "B",
      "scope": "only_preexisting_fair_no_new_festivals",
      "provenance": "AUTHORED_CONCEPT",
      "approval": "AUTHOR_BATCH_2026-10-23",
      "createsInstitutions": false,
      "createsPersons": false,
      "createsEvents": false,
      "createsLocalLaw": false
    },
    {
      "id": "DAR-D10-14",
      "option": "B",
      "scope": "funeral_norgard_no_new_rites",
      "provenance": "AUTHORED_CONCEPT",
      "approval": "AUTHOR_BATCH_2026-10-23",
      "createsInstitutions": false,
      "createsPersons": false,
      "createsEvents": false,
      "createsLocalLaw": false
    },
    {
      "id": "DAR-D10-15",
      "option": "B",
      "scope": "family_neighbor_network_contextual",
      "provenance": "AUTHORED_CONCEPT",
      "approval": "AUTHOR_BATCH_2026-10-23",
      "createsInstitutions": false,
      "createsPersons": false,
      "createsEvents": false,
      "createsLocalLaw": false
    },
    {
      "id": "DAR-D10-16",
      "option": "B",
      "scope": "names_norgard_register_contextual",
      "provenance": "AUTHORED_CONCEPT",
      "approval": "AUTHOR_BATCH_2026-10-23",